[
  {
    "id": "00000000-0000-4000-8000-000000000001",
    "name": "Synthela 01",
    "asset_type": "common_stock",
    "currency": "USD"
  },
  {
    "id": "00000000-0000-4000-8000-000000000002",
    "name": "Synthela 02",
    "asset_type": "common_stock",
    "currency": "USD"
  },
  {
    "id": "00000000-0000-4000-8000-000000000003",
    "name": "Synthela 03",
    "asset_type": "common_stock",
    "currency": "USD"
  },
  {
    "id": "00000000-0000-4000-8000-000000000004",
    "name": "Synthela 04",
    "asset_type": "common_stock",
    "currency": "USD"
  },
  {
    "id": "00000000-0000-4000-8000-000000000005",
    "name": "Synthela 05",
    "asset_type": "common_stock",
    "currency": "USD"
  },
  {
    "id": "00000000-0000-4000-8000-000000000006",
    "name": "Synthela 06",
    "asset_type": "common_stock",
    "currency": "USD"
  },
  {
    "id": "00000000-0000-4000-8000-000000000007",
    "name": "Synthela 07",
    "asset_type": "common_stock",
    "currency": "USD"
  },
  {
    "id": "00000000-0000-4000-8000-000000000008",
    "name": "Synthela 08",
    "asset_type": "common_stock",
    "currency": "USD"
  },
  {
    "id": "00000000-0000-4000-8000-000000000009",
    "name": "Synthela 09",
    "asset_type": "common_stock",
    "currency": "USD"
  },
  {
    "id": "00000000-0000-4000-8000-000000000010",
    "name": "Synthela 10",
    "asset_type": "common_stock",
    "currency": "USD"
  },
  {
    "id": "00000000-0000-4000-8000-000000000011",
    "name": "Synthela 11",
    "asset_type": "common_stock",
    "currency": "USD"
  },
  {
    "id": "00000000-0000-4000-8000-000000000012",
    "name": "Synthela 12",
    "asset_type": "common_stock",
    "currency": "USD"
  },
  {
    "id": "00000000-0000-4000-8000-000000000013",
    "name": "Synthela 13",
    "asset_type": "common_stock",
    "currency": "USD"
  },
  {
    "id": "00000000-0000-4000-8000-000000000014",
    "name": "Synthela 14",
    "asset_type": "common_stock",
    "currency": "USD"
  },
  {
    "id": "00000000-0000-4000-8000-000000000015",
    "name": "Synthela 15",
    "asset_type": "common_stock",
    "currency": "USD"
  },
  {
    "id": "00000000-0000-4000-8000-000000000016",
    "name": "Synthela 16",
    "asset_type": "common_stock",
    "currency": "USD"
  },
  {
    "id": "00000000-0000-4000-8000-000000000017",
    "name": "Synthela 17",
    "asset_type": "common_stock",
    "currency": "USD"
  },
  {
    "id": "00000000-0000-4000-8000-000000000018",
    "name": "Synthela 18",
    "asset_type": "common_stock",
    "currency": "USD"
  },
  {
    "id": "00000000-0000-4000-8000-000000000019",
    "name": "Synthela 19",
    "asset_type": "common_stock",
    "currency": "USD"
  },
  {
    "id": "00000000-0000-4000-8000-000000001001",
    "name": "Synthela 02 Preferred",
    "asset_type": "preferred_stock",
    "currency": "USD"
  },
  {
    "id": "00000000-0000-4000-8000-000000001002",
    "name": "Synthela 20",
    "asset_type": "common_stock",
    "currency": "USD"
  },
  {
    "id": "00000000-0000-4000-8000-000000001003",
    "name": "Synthela 21",
    "asset_type": "common_stock",
    "currency": "CAD"
  },
  {
    "id": "00000000-0000-4000-8000-000000001004",
    "name": "Synthela 22",
    "asset_type": "common_stock",
    "currency": "USD"
  }
]
